<?xml version="1.0" encoding="UTF-8"?>
<!DOCTYPE mapper PUBLIC "-//dbvisitor.net//DTD Mapper 1.0//EN" "https://www.dbvisitor.net/schema/dbvisitor-mapper.dtd">
<mapper namespace="resultMap_test">
    <resultMap id="resultMap_1" type="net.hasor.test.entity.BlobResourceV1"/>
    <resultMap id="resultMap_2" type="net.hasor.test.entity.BlobResourceV2"/>
    <resultMap id="resultMap_3" type="net.hasor.test.entity.BlobResourceV3"/>
    <resultMap id="resultMap_4" type="net.hasor.test.entity.BlobResourceV4"/>
    <resultMap id="resultMap_5" type="net.hasor.test.entity.BlobResourceV5"/>
    <resultMap id="resultMap_6" type="net.hasor.test.entity2.BlobResourceV6"/>
    <resultMap id="resultMap_7" type="net.hasor.test.entity2.BlobResourceV7"/>
    <resultMap id="resultMap_8" type="net.hasor.test.entity2.BlobResourceV8"/>
    <resultMap id="resultMap_9" type="net.hasor.test.entity2.BlobResourceV9"/>
    <resultMap id="resultMap_10" type="net.hasor.test.entity2.BlobResourceV10"/>

    <entity id="entityMap_1" type="net.hasor.test.entity.BlobResourceV1"/>
    <entity id="entityMap_2" type="net.hasor.test.entity.BlobResourceV2"/>
    <entity id="entityMap_3" type="net.hasor.test.entity.BlobResourceV3"/>
    <entity id="entityMap_4" type="net.hasor.test.entity.BlobResourceV4"/>
    <entity id="entityMap_5" table="blob_resource" type="net.hasor.test.entity.BlobResourceV5"/>
    <entity id="entityMap_6" type="net.hasor.test.entity2.BlobResourceV6"/>
    <entity id="entityMap_7" type="net.hasor.test.entity2.BlobResourceV7"/>
    <entity id="entityMap_8" type="net.hasor.test.entity2.BlobResourceV8"/>
    <entity id="entityMap_9" type="net.hasor.test.entity2.BlobResourceV9"/>
    <entity id="entityMap_10" table="blob_resource" type="net.hasor.test.entity2.BlobResourceV10"/>

    <resultMap id="repeat_1" type="net.hasor.test.entity2.BlobResourceV9"/>
</mapper>