<?xml version="1.0" encoding="UTF-8"?>
<!DOCTYPE mapper PUBLIC "-//dbvisitor.net//DTD Mapper 1.0//EN" "https://www.dbvisitor.net/schema/dbvisitor-mapper.dtd">
<mapper autoMapping="true">
    <resultMap id="mapper_2" type="net.hasor.test.dto.UserInfo2"/>

    <resultMap id="mapper_3" type="net.hasor.test.dto.UserInfo"/>

    <resultMap id="mapper_4" type="net.hasor.test.dto.UserInfo" autoMapping="false">
        <result column="user_uuid" property="userUuid"/>
        <result column="name" property="name"/>
        <result column="login_name" property="loginName"/>
        <result column="login_password" property="loginPassword"/>
        <result column="email" property="email"/>
        <result column="index" property="seq" javaType="int"/>
        <result column="register_time" property="registerTime"/>
    </resultMap>

    <resultMap id="mapper_5" type="net.hasor.test.dto.UserInfo" mapUnderscoreToCamelCase="true"/>
</mapper>